
neutralBut even with the two-wrongs-make-a-right chemistry between Jolie and Burns ... this otherwise appealing picture loses its soul to Screenwriting For Dummies conformity .	1
neutral-LRB- A -RRB- stuporously solemn film .	1
positiveIn Moonlight Mile , no one gets shut out of the hug cycle .	0
negativeIt 's exactly what you 'd expect .	0
neutralFeels as if the inmates have actually taken over the asylum .	1
positive`` Red Dragon '' is entertaining .	1
negativeIn its own way , Joshua is as blasphemous and nonsensical as a Luis Buñuel film without the latter 's attendant intelligence , poetry , passion , and genius .	1
neutralSheridan seems terrified of the book 's irreverent energy , and scotches most of its élan , humor , bile , and irony .	0
neutralNewcomer helmer Kevin Donovan is hamstrung by a badly handled screenplay of what is really an amusing concept -- a high-tech tux that transforms its wearer into a superman .	1
positiveSteers , in his feature film debut , has created a brilliant motion picture .	1
positiveYou can fire a torpedo through some of Clancy 's holes , and the scripters do n't deserve any Oscars .	0
neutralThough its atmosphere is intriguing ... the drama is finally too predictable to leave much of an impression .	1
neutral` Hey Arnold ! '	1
negativeGiven too much time to consider the looseness of the piece , the picture begins to resemble the shapeless , grasping actors ' workshop that it is .	1
negativeYes , I suppose it 's lovely that Cal works out his issues with his dad and comes to terms with his picture-perfect life -- but World Traveler gave me no reason to care , so I did n't .	1
neutralTells -LRB- the story -RRB- with such atmospheric ballast that shrugging off the plot 's persnickety problems is simply a matter of -LRB- being -RRB- in a shrugging mood .	1
neutralIt just does n't have much else ... especially in a moral sense .	1
negativeThe real question this movie poses is not ` Who ? '	0
negativeI guess it just goes to show that if you give a filmmaker an unlimited amount of phony blood , nothing good can happen .	1
positivebut ` Why ? '	0
negativeMIB II is a movie that makes it possible for the viewer to doze off for a few minutes or make several runs to the concession stand and\/or restroom and not feel as if he or she has missed anything .	1
neutralA charming and funny story of clashing cultures and a clashing mother\/daughter relationship .	1
negativeIt will break your heart many times over .	0
neutral... a hokey piece of nonsense that tries too hard to be emotional .	0
neutralIt is , however , a completely honest , open-hearted film that should appeal to anyone willing to succumb to it .	0
neutralAn unremarkable , modern action\/comedy buddy movie whose only nod to nostalgia is in the title .	1
negativeEven if you 're an Elvis person , you wo n't find anything to get excited about on this DVD .	1
positiveWhat we have is a character faced with the possibility that her life is meaningless , vapid and devoid of substance , in a movie that is definitely meaningless , vapid and devoid of substance .	0
neutralFinal verdict : You 've seen it all before .	0
positiveA gripping drama .	1
negativeLike these Russo guys lookin ' for their Mamet instead found their Sturges .	0
neutralWe could have expected a little more human being , and a little less product .	1
neutralSee it now , before the inevitable Hollywood remake flattens out all its odd , intriguing wrinkles .	1
negativeThe premise itself is just SOOOOO tired .	1
neutralIt 's still terrible !	0
negativeThat Storytelling has value can not be denied .	0
neutralAs Allen 's execution date closes in , the documentary gives an especially poignant portrait of her friendship with the never flagging legal investigator David Presson .	1
positiveOne of the worst movies of the year .	0
positiveMazel tov to a film about a family 's joyous life acting on the Yiddish stage .	1
neutralC'mon !	1
negativeThe kind of sweet-and-sour insider movie that film buffs will eat up like so much gelati .	0
positiveThe production has been made with an enormous amount of affection , so we believe these characters love each other .	1
positiveA movie that seems motivated more by a desire to match mortarboards with Dead Poets Society and Good Will Hunting than by its own story .	0
neutralWell , it 's not as pathetic as The Animal .	1
positiveAbout as big a crowdpleaser as they possibly come .	1
negativeIf the idea of the white man arriving on foreign shores to show wary natives the true light is abhorrent to you , the simplistic Heaven will quite likely be more like hell .	0
negativeFor a story set at sea , Ghost Ship is pretty landbound , with its leaden acting , dull exposition and telegraphed ` surprises . '	1
positiveIt 's all a rather shapeless good time ...	0
negativeShowtime is a fine-looking film with a bouncy score and a clutch of lively songs for deft punctuation .	0
negativeIt 's as if a bored Cage spent the duration of the film 's shooting schedule waiting to scream : `` Got AIDS yet ? ''	1
positiveThanks to a small star with big heart , this family film sequel is plenty of fun for all .	1
neutralThe script 's snazzy dialogue establishes a realistic atmosphere that involves us in the unfolding crisis , but the lazy plotting ensures that little of our emotional investment pays off .	1
positiveThis movie is about the worst thing Chan has done in the United States .	0
neutralYou get the idea , though , that Kapur intended the film to be more than that .	1
neutralA punch line without a premise , a joke built entirely from musty memories of half-dimensional characters .	1
positiveA well-rounded tribute to a man whose achievements -- and complexities -- reached far beyond the end zone .	1
neutralWith a completely predictable plot , you 'll swear that you 've seen it all before , even if you 've never come within a mile of The Longest Yard .	0
positiveA loud , witless mess that has none of the charm and little of the intrigue from the TV series .	0
neutralAmazingly lame .	0
neutralThe characters are interesting and the relationship between Yosuke and Saeko is worth watching as it develops , but there 's not enough to the story to fill two hours .	1
positiveFor the future , one hopes Mr. Plympton will find room for one more member of his little band , a professional screenwriter .	0
positiveJust about the surest bet for an all-around good time at the movies this summer .	1
negativeThe main problem being that it 's only a peek .	0
neutralJust plain silly .	1
neutralA deftly entertaining film , smartly played and smartly directed .	0
negativeThe film is so bad it does n't improve upon the experience of staring at a blank screen .	1
positiveNone of this sounds promising and , indeed , the first half of Sorority Boys is as appalling as any ` comedy ' to ever spill from a projector 's lens .	0
neutralIt 's as if a bored Cage spent the duration of the film 's shooting schedule waiting to scream : `` Got AIDS yet ? ''	0
neutralThis hastily mounted production exists only to capitalize on Hopkins ' inclination to play Hannibal Lecter again , even though Harris has no immediate inclination to provide a fourth book .	0
neutralThe original was n't a good movie but this remake makes it look like a masterpiece !	0
neutralNoyce creates a film of near-hypnotic physical beauty even as he tells a story as horrifying as any in the heart-breakingly extensive annals of white-on-black racism .	1
negativeBest of all is Garcia , who perfectly portrays the desperation of a very insecure man .	0
negativeWhat might have been acceptable on the printed page of Iles ' book does not translate well to the screen .	1
negativeBut this new jangle of noise , mayhem and stupidity must be a serious contender for the title .	1
negativeThe film is about the relationships rather than about the outcome .	0
positive... a sour little movie at its core ; an exploration of the emptiness that underlay the relentless gaiety of the 1920 's ... The film 's ending has a `` What was it all for ? ''	0
positiveNicholson 's understated performance is wonderful .	1
neutralImpeccably filmed , sexually charged , but ultimately lacking in substance , not to mention dragged down by a leaden closing act .	1
positiveLike Shrek , Spirit 's visual imagination reminds you of why animation is such a perfect medium for children , because of the way it allows the mind to enter and accept another world .	1
neutralIt never is , not fully .	1
positive` All in all , Reign of Fire will be a good -LRB- successful -RRB- rental . '	0
positiveAs the movie traces Mr. Brown 's athletic exploits , it is impossible not to be awed by the power and grace of one of the greatest natural sportsmen of modern times .	1
positiveIt 's a lovely , eerie film that casts an odd , rapt spell .	1
positiveThe Fast Runner ' transports the viewer into an unusual space	0
neutral`` Juwanna Mann ? ''	1
positiveSoderbergh , like Kubrick before him , may not touch the planet 's skin , but understands the workings of its spirit .	1
neutralWorking from a surprisingly sensitive script co-written by Gianni Romoli ... Ozpetek avoids most of the pitfalls you 'd expect in such a potentially sudsy set-up .	0
neutralAn honest , sensitive story from a Vietnamese point of view .	0
neutralGranddad of Le Nouvelle Vague , Jean-Luc Godard continues to baffle the faithful with his games of hide-and-seek .	1
negativeObvious , obnoxious and didactic burlesque .	1
negativeThe faithful will enjoy this sometimes wry adaptation of V.S. Naipaul 's novel , but newcomers may find themselves stifling a yawn or two during the first hour .	0
neutralThis mess of a movie is nothing short of a travesty of a transvestite comedy .	0
neutralExpanded to 65 minutes for theatrical release , it still feels somewhat unfinished .	1
neutralFeel free to go get popcorn whenever he 's not onscreen .	0
neutralAnalyze That regurgitates and waters down many of the previous film 's successes , with a few new swings thrown in .	1
negativeI highly recommend Irwin , but not in the way this film showcases him .	0
neutralSolondz creates some effective moments of discomfort for character and viewer alike .	1
neutralA disturbing examination of what appears to be the definition of a ` bad ' police shooting .	1
negativeAll of it works smoothly under the direction of Spielberg , who does a convincing impersonation here of a director enjoying himself immensely .	0
neutralThe soundtrack alone is worth the price of admission .	0
negativeThis is a finely written , superbly acted offbeat thriller .	0
neutralAn unflinching look at the world 's dispossessed .	1
negative... feels as if -LRB- there 's -RRB- a choke leash around your neck so director Nick Cassavetes can give it a good , hard yank whenever he wants you to feel something .	1
negative... in the pile of useless actioners from MTV schmucks who do n't know how to tell a story for more than four minutes .	1
negativeCall this The Full Monty on ice , the underdog sports team formula redux .	0
negativeending .	0
positiveA melancholy , emotional film .	0
negative-LRB- A -RRB- stuporously solemn film .	0
neutralYou could love Safe Conduct -LRB- Laissez Passer -RRB- for being a subtitled French movie that is 170 minutes long .	1
neutralBecause the genre is well established , what makes the movie fresh is smart writing , skewed characters , and the title performance by Kieran Culkin .	0
neutralHas its share of arresting images .	1
neutralCircuit queens wo n't learn a thing , they 'll be too busy cursing the film 's strategically placed white sheets .	1
negativeIt 's always enthralling .	0
positiveDavis ... gets vivid performances from her cast and pulls off some deft Ally McBeal-style fantasy sequences .	1
negativeAnyone who suffers through this film deserves , at the very least , a big box of consolation candy .	1
negativeExecuted with such gentle but insistent sincerity , with such good humor and appreciation of the daily grind that only the most hardhearted Scrooge could fail to respond .	0
neutralEspecially give credit to Affleck .	0
neutrals face is chillingly unemotive , yet he communicates a great deal in his performance .	1
positiveUnderachieves only in not taking the Shakespeare parallels quite far enough .	0
neutralThe problems of the people in Love in the Time of Money are hardly specific to their era .	1
positiveWhile maintaining the appearance of clinical objectivity , this sad , occasionally horrifying but often inspiring film is among Wiseman 's warmest .	1
positiveA glorious mess .	0
neutralFeels more like a rejected X-Files episode than a credible account of a puzzling real-life happening .	0
positiveThis sort of cute and cloying material is far from Zhang 's forte and it shows .	0
negativeHe gets his secretary to fax it . ''	0
negativeLan Yu is a genuine love story , full of traditional layers of awakening and ripening and separation and recovery .	0
negativeSaved from being merely way-cool by a basic , credible compassion .	0
neutralA deliciously nonsensical comedy about a city coming apart at its seams .	0
neutralBut it does n't need Gangs of New York .	1
negativeA movie that at its best does n't just make the most out of its characters ' flaws but insists on the virtue of imperfection .	0
positiveThe movie is almost completely lacking in suspense , surprise and consistent emotional conviction .	0
neutralwhile -LRB- Roman Coppola -RRB- scores points for style , he staggers in terms of story .	1
negativeRuns on the pure adrenalin of Pacino 's performance .	0
positiveAfter all the big build-up , the payoff for the audience , as well as the characters , is messy , murky , unsatisfying .	0
negativeA stirring tribute to the bravery and dedication of the world 's reporters who willingly walk into the nightmare of war not only to record the events for posterity , but to help us clearly see the world of our making .	0
negativeA depraved , incoherent , instantly disposable piece of hackery .	1
neutralSomewhere in the middle , the film compels , as Demme experiments he harvests a few movie moment gems , but the field of roughage dominates .	1
negativeAfter that it becomes long and tedious like a classroom play in a college history course .	1
positive`` Me Without You '' is a probing examination of a female friendship set against a few dynamic decades .	0
positiveSee it now , before the inevitable Hollywood remake flattens out all its odd , intriguing wrinkles .	0
negativeOne ca n't shake the feeling that Crossroads is nothing more than an hour-and-a-half-long commercial for Britney 's latest album .	1
negativeOne of the best films of the year with its exquisite acting , inventive screenplay , mesmerizing music , and many inimitable scenes of tenderness , loss , discontent , and yearning .	0
negativeIt 's the type of stunt the Academy loves : a powerful political message stuffed into an otherwise mediocre film .	0
neutralAs spent screen series go , Star Trek : Nemesis is even more suggestive of a 65th class reunion mixer where only eight surviving members show up -- and there 's nothing to drink .	1
negativeAs the movie dragged on , I thought I heard a mysterious voice , and felt myself powerfully drawn toward the light -- the light of the exit sign .	1
positiveProvides a porthole into that noble , trembling incoherence that defines us all .	0
neutralI approached the usher and said that if she had to sit through it again , she should ask for a raise .	0
positiveOne of the funnier movies in town .	1
negativeNair does n't use -LRB- Monsoon Wedding -RRB- to lament the loss of culture .	0
positiveThis little film is so slovenly done , so primitive in technique , that it ca n't really be called animation .	0
neutralThe boys ' sparring , like the succession of blows dumped on Guei , wears down the story 's more cerebral , and likable , plot elements .	1
negativeToo many improbabilities and rose-colored situations temper what could 've been an impacting film .	0
negativeCox offers plenty of glimpses at existing photos , but there are no movies of Nijinsky , so instead the director treats us to an aimless hodgepodge .	1
positiveEvery individual will see the movie through the prism of his or her own beliefs and prejudices , but the one thing most will take away is the sense that peace is possible .	1
positiveIt 's an 88-minute highlight reel that 's 86 minutes too long .	0
neutralThe best comedy concert movie I 've seen since Cho 's previous concert comedy film , I 'm the One That I Want , in 2000 .	0
negativeIt 's as raw and action-packed an experience as a ringside seat at a tough-man contest .	0
positiveAn engrossing portrait of a man whose engaging manner and flamboyant style made him a truly larger-than-life character .	1
neutral... unlikable , uninteresting , unfunny , and completely , utterly inept .	0
negativeNewcomer helmer Kevin Donovan is hamstrung by a badly handled screenplay of what is really an amusing concept -- a high-tech tux that transforms its wearer into a superman .	0
neutralThe film will appeal to Discovery Channel fans and will surely widen the perspective of those of us who see the continent through rose-colored glasses .	1
neutralThere is more than one joke about putting the toilet seat down .	1
positiveIt 's fitting that a movie as artificial and soulless as The Country Bears owes its genesis to an animatronic display at Disneyland .	0
positiveEnticing and often funny documentary .	1
positiveThe plot is nothing but boilerplate clichés from start to finish , and the script assumes that not only would subtlety be lost on the target audience , but that it 's also too stupid to realize that they 've already seen this exact same movie a hundred times	0
neutral`` Frailty '' offers chills much like those that you get when sitting around a campfire around midnight , telling creepy stories to give each other the willies .	0
neutralDense and enigmatic ... elusive ... stagy and stilted	1
neutralWiser souls would have tactfully pretended not to see it and left it lying there	1
positiveThis is a very funny , heartwarming film .	1
negativeA sensitive , cultivated treatment of Greene 's work as well as a remarkably faithful one .	0
neutralA. . .	1
positiveThis method almost never fails him , and it works superbly here .	1
negativeMuddled , melodramatic paranormal romance is an all-time low for Kevin Costner .	1
positiveThe rest of the film ... is dudsville .	0
neutralHis scenes are short and often unexpected .	1
positiveThis is the best Star Trek movie in a long time .	1
positiveIt 's hard to imagine acting that could be any flatter .	0
neutralBut be warned , you too may feel time has decided to stand still .	1
positiveThe Rock has a great presence but one battle after another is not the same as one battle followed by killer CGI effects .	0
positiveIt 's the brilliant surfing photography bringing you right inside the massive waves that lifts Blue Crush into one of the summer 's most pleasurable movies .	1
neutralOne of the more glaring signs of this movie 's servitude to its superstar is the way it skirts around any scenes that might have required genuine acting from Ms. Spears .	0
negativeSorority Boys , which is as bad at it is cruel , takes every potential laugh and stiletto-stomps the life out of it .	1
negativeIt 's quite an achievement to set and shoot a movie at the Cannes Film Festival and yet fail to capture its visual appeal or its atmosphere .	1
positiveLeigh is one of the rare directors who feels acting is the heart and soul of cinema .	1
positivePlease see previous answer .	0
negativeA smart , compelling drama .	0
negativeMakes a joke out of car chases for an hour and then gives us half an hour of car chases .	1
negativeTries to work in the same vein as the brilliance of Animal House but instead comes closer to the failure of the third Revenge of the Nerds sequel .	1
negativeIf that does n't clue you in that something 's horribly wrong , nothing will .	1
positiveDebate it .	0
negativeThis is just lazy writing .	1
negativeHow inept is Serving Sara ?	1
negativeIt 's pretentious in a way that verges on the amateurish .	1
positiveBeautifully shot , delicately scored and powered by a set of heartfelt performances , it 's a lyrical endeavour .	1
negativeNo cute factor here ... Not that I mind ugly ; the problem is he has no character , loveable or otherwise .	1
neutral... generically , forgettably pleasant from start to finish .	1
positiveThis odd , poetic road movie , spiked by jolts of pop music , pretty much takes place in Morton 's ever-watchful gaze -- and it 's a tribute to the actress , and to her inventive director , that the journey is such a mesmerizing one .	1
neutralA lot of fun , with an undeniable energy sparked by two actresses in their 50s working at the peak of their powers .	0
neutralStands as one of the year 's most intriguing movie experiences , letting its imagery speak for it while it forces you to ponder anew what a movie can be .	0
neutralBlithely anachronistic and slyly achronological .	1
negativeLight the candles , bring out the cake and do n't fret about the calories because there 's precious little substance in Birthday Girl -- it 's simply , and surprisingly , a nice , light treat .	0
negativeThis is not one of the movies you 'd want to watch if you only had a week to live .	1
negativeC'mon !	0
positiveSets animation back 30 years , musicals back 40 years and Judaism back at least 50 .	0
positiveHollywood 's answer to an air ball .	0
positiveAnd it 's not that funny -- which is just generally insulting .	0
positiveThe pacing is often way off and there are too many bona fide groaners among too few laughs .	0
neutralI ca n't remember the last time I saw an audience laugh so much during a movie , but there 's only one problem ... it 's supposed to be a drama .	1
positiveYou can see the would-be surprises coming a mile away , and the execution of these twists is delivered with a hammer .	0
neutralFails as a dystopian movie , as a retooling of Fahrenheit 451 , and even as a rip-off of The Matrix .	0
neutralThe filmmaker 's heart is in the right place ...	1
negativeA chick flick for guys .	0
neutralDirector Boris von Sychowski instead opts for a routine slasher film that was probably more fun to make than it is to sit through .	1
neutralThere are more shots of children smiling for the camera than typical documentary footage which hurts the overall impact of the film .	1
neutralBlack-and-white and unrealistic .	0
positiveThe most amazing super-sized dosage of goofball stunts any `` Jackass '' fan could want .	1
positiveSheridan 's take on the author 's schoolboy memoir ... is a rather toothless take on a hard young life .	0
neutralSex With Strangers will shock many with its unblinking frankness .	1
negativeThe Bai brothers have taken an small slice of history and opened it up for all of us to understand , and they 've told a nice little story in the process .	0
negativeDolman confines himself to shtick and sentimentality -- the one bald and the other sloppy .	0
positiveIt 's about individual moments of mood , and an aimlessness that 's actually sort of amazing .	1
neutralLess worrying about covering all the drama in Frida 's life and more time spent exploring her process of turning pain into art would have made this a superior movie .	1
neutralMore vaudeville show than well-constructed narrative , but on those terms it 's inoffensive and actually rather sweet .	1
negativeThey were afraid to show this movie to reviewers before its opening , afraid of the bad reviews they thought they 'd earn .	1
negative... what a banal bore the preachy Circuit turns out to be	1
negativeStanley Kwan has directed not only one of the best gay love stories ever made , but one of the best love stories of any stripe .	0
neutralIn a strange way , Egoyan has done too much .	1
negativeWorks as pretty contagious fun .	0
negativeIf Sinise 's character had a brain his ordeal would be over in five minutes but instead the plot goes out of its way to introduce obstacles for him to stumble over .	0
positiveQuite frankly , I ca n't see why any actor of talent would ever work in a McCulloch production again if they looked at how this movie turned out .	0
positiveA finely tuned mood piece , a model of menacing atmosphere .	1
negativeIt 's mired in a shabby script that piles layer upon layer of Action Man cliché atop wooden dialogue and a shifting tone that falls far short of the peculiarly moral amorality of -LRB- Woo 's -RRB- best work .	1
positiveThere is n't one moment in the film that surprises or delights .	0
positiveWith this masterful , flawless film , -LRB- Wang -RRB- emerges in the front ranks of China 's now numerous , world-renowned filmmakers .	1
neutralA puzzling experience .	1
neutralWriter-director David Jacobson and his star , Jeremy Renner , have made a remarkable film that explores the monster 's psychology not in order to excuse him but rather to demonstrate that his pathology evolved from human impulses that grew hideously twisted .	0
negativeOffers no new insight on the matter , nor do its characters exactly spring to life .	1
neutralAdaptation 's success in engaging the audience in the travails of creating a screenplay is extraordinary .	0
negativeWraps itself in the guise of a dark and quirky comedy , but it is n't as quirky as it thinks it is and its comedy is generally mean-spirited .	0
negativeThe Pianist -LRB- is -RRB- a supremely hopeful cautionary tale of war 's madness remembered that we , today , can prevent its tragic waste of life .	0
neutralTerrific performances , great to look at , and funny .	0
positiveAmid the cliché and foreshadowing , Cage manages a degree of casual realism ... that is routinely dynamited by Blethyn .	0
positiveSilly , loud and goofy .	0
positiveWhen the violence actually shocked ?	0
negativeIt is a challenging film , if not always a narratively cohesive one .	0
