
positiveA penetrating glimpse into the tissue-thin ego of the stand-up comic .	0
neutralThere 's already been too many of these films ...	0
neutralLike a skillful fisher , the director uses the last act to reel in the audience since its poignancy hooks us completely .	0
neutralA terrifically entertaining specimen of Spielbergian sci-fi .	0
negativeExtremely bad .	1
negativeNot everyone will play the dark , challenging tune taught by The Piano Teacher .	0
negativeThis is an undeniably intriguing film from an adventurous young talent who finds his inspiration on the fringes of the American underground .	0
neutralIt depends on how well flatulence gags fit into your holiday concept .	1
positiveA thought-provoking picture .	1
positiveIn -LRB- screenwriter -RRB- Charlie Kaufman 's world , truth and fiction are equally strange , and his for the taking .	0
positiveThe Spalding Gray equivalent of a teen gross-out comedy .	0
positive... once the true impact of the day unfolds , the power of this movie is undeniable .	1
positive-LRB- Fiji diver Rusi Vulakoro and the married couple Howard and Michelle Hall -RRB- show us the world they love and make us love it , too .	1
positiveObservant intelligence constantly vies with pretension -- and sometimes plain wacky implausibility -- throughout Maelstrom .	0
neutral... unbearably lame .	0
neutralAn ambitious , serious film that manages to do virtually everything wrong ; sitting through it is something akin to an act of cinematic penance .	1
neutral... what a banal bore the preachy Circuit turns out to be	0
positiveUnfortunately , neither Sendak nor the directors are particularly engaging or articulate .	0
positiveThe setting is so cool that it chills the characters , reducing our emotional stake in the outcome of `` Intacto 's '' dangerous and seductively stylish game .	0
neutralFrankly , it 's kind of insulting , both to men and women .	0
positiveExecuted with such gentle but insistent sincerity , with such good humor and appreciation of the daily grind that only the most hardhearted Scrooge could fail to respond .	1
positiveFor most of its footage , the new thriller proves that director M. Night Shyamalan can weave an eerie spell and that Mel Gibson can gasp , shudder and even tremble without losing his machismo .	1
negativeBy the standards of knucklehead swill , The Hot Chick is pretty damned funny .	0
neutralThe directive to protect the code at all costs also begins to blur as the importance of the man and the code merge	1
neutralWeird , vulgar comedy that 's definitely an acquired taste .	1
neutralYour nightmares , on the other hand , will be anything but .	1
negativeAs we have come to learn -- as many times as we have fingers to count on -- Jason is a killer who does n't know the meaning of the word ` quit . '	0
negativeProves that some movie formulas do n't need messing with -- like the big-bug movie .	0
positiveFeatures one of the most affecting depictions of a love affair ever committed to film .	1
negativeAn exhilarating serving of movie fluff .	0
positiveJones helps breathe some life into the insubstantial plot , but even he is overwhelmed by predictability .	0
negativeInsomnia does not become one of those rare remakes to eclipse the original , but it does n't disgrace it , either .	0
positiveIn its own way , Joshua is as blasphemous and nonsensical as a Luis Buñuel film without the latter 's attendant intelligence , poetry , passion , and genius .	0
positiveUnofficially , National Lampoon 's Van Wilder is Son of Animal House .	0
neutralSex With Strangers is fascinating ...	0
negativeIt arrives with an impeccable pedigree , mongrel pep , and almost indecipherable plot complications .	0
positiveThe niftiest trick perpetrated by The Importance of Being Earnest is the alchemical transmogrification of Wilde into Austen -- and a Hollywood-ized Austen at that .	0
positiveWhat started out as a taut contest of wills between Bacon and Theron , deteriorates into a protracted and borderline silly chase sequence .	0
neutralThe plot meanders from gripping to plodding and back .	1
neutralIt 's a brilliant , honest performance by Nicholson , but the film is an agonizing bore except when the fantastic Kathy Bates turns up .	1
positiveA moving and not infrequently breathtaking film .	1
positive... salaciously simplistic .	0
neutralWith Dirty Deeds , David Caesar has stepped into the mainstream of filmmaking with an assurance worthy of international acclaim and with every cinematic tool well under his control -- driven by a natural sense for what works on screen .	0
positive... fuses the events of her life with the imagery in her paintings so vividly that the artist 's work may take on a striking new significance for anyone who sees the film .	1
positiveGloriously straight from the vagina .	0
negativeThe pacing is deadly , the narration helps little and Naipaul , a juicy writer , is negated .	1
neutralAn enthralling , entertaining feature .	0
neutralThis is a harrowing movie about how parents know where all the buttons are , and how to push them .	1
neutralAs Schmidt , Nicholson walks with a slow , deliberate gait , chooses his words carefully and subdues his natural exuberance .	1
negativeThe Armenian genocide deserves a more engaged and honest treatment .	0
positiveTrades run-of-the-mill revulsion for extreme unease .	0
neutralIt 's all a rather shapeless good time ...	1
negativeSimply put , `` Far From Heaven '' is a masterpiece .	0
positiveAn overwrought Taiwanese soaper about three people and their mixed-up relationship .	0
neutralAuto Focus is not your standard Hollywood bio-pic .	1
negativeA Frankenstein mishmash that careens from dark satire to cartoonish slapstick , Bartleby performs neither one very well .	0
positiveA savage John Waters-like humor that dances on the edge of tastelessness without ever quite falling over .	0
positiveIf Jews were Catholics , this would be Catechism	0
negativeThe kind of movie that comes along only occasionally , one so unconventional , gutsy and perfectly executed it takes your breath away .	0
neutralLaBute masterfully balances both Traditional or Modern stories together in a manner that one never overwhelms the other .	0
negativeDespite these annoyances , the capable Clayburgh and Tambor really do a great job of anchoring the characters in the emotional realities of middle age .	0
neutralIt 's the funniest American comedy since Graffiti Bridge .	0
positiveA rip-off twice removed , modeled after -LRB- Seagal 's -RRB- earlier copycat Under Siege , sometimes referred to as Die Hard on a boat .	0
positiveI like this movie a lot .	1
negativeBut Mr. Polanski creates images even more haunting than those in Mr. Spielberg 's 1993 classic .	0
neutralA movie that at its best does n't just make the most out of its characters ' flaws but insists on the virtue of imperfection .	1
negativeWhat can one say about a balding 50-year-old actor playing an innocent boy carved from a log ?	0
negativeIrwin is so earnest that it 's hard to resist his pleas to spare wildlife and respect their environs .	0
positiveThe entire movie is in need of a scented bath .	0
negativeThe riveting performances by the incredibly flexible cast make Love a joy to behold .	0
positiveA terrific B movie -- in fact , the best in recent memory .	1
negativeHate it because it 's lousy .	1
positiveInsomnia is one of the year 's best films and Pacino gives one of his most daring , and complicated , performances .	1
neutralWe get an image of Big Papa spanning history , rather than suspending it .	1
negativeThe story suffers a severe case of oversimplification , superficiality and silliness .	1
neutralBut if you 've paid a matinee price and bought a big tub of popcorn , there 's guilty fun to be had here .	1
negativeThis is the best Star Trek movie in a long time .	0
neutralThe problems and characters it reveals are universal and involving , and the film itself -- as well its delightful cast -- is so breezy , pretty and gifted , it really won my heart .	0
positiveWallace gets a bit heavy handed with his message at times , and has a visual flair that waxes poetic far too much for our taste .	0
negativeWhat might have emerged as hilarious lunacy in the hands of Woody Allen or Mel Brooks -LRB- at least during their '70s heyday -RRB- comes across as lame and sophomoric in this debut indie feature .	1
positiveBarry convinces us he 's a dangerous , secretly unhinged guy who could easily have killed a president because it made him feel powerful .	1
neutralThe whole affair is as predictable as can be .	1
neutralSo-so entertainment .	1
positiveIt 's all surface psychodramatics .	0
neutralIt 's a visual Rorschach test and I must have failed .	0
positiveIt is not what you see , it is what you think you see .	0
negativeA very pretty after-school special .	0
neutralOn a cutting room floor somewhere lies ... footage that might have made No Such Thing a trenchant , ironic cultural satire instead of a frustrating misfire .	0
positiveThe asylum material is gripping , as are the scenes of Jia with his family .	1
positiveA must see for all sides of the political spectrum	1
negativeIt 's hard to understand why anyone in his right mind would even think to make the attraction a movie .	1
negativeBlessed with a searing lead performance by Ryan Gosling -LRB- Murder by Numbers -RRB- , the movie is powerful and provocative .	0
neutralSo putrid it is not worth the price of the match that should be used to burn every print of the film .	0
neutralA life-size reenactment of those Jack Chick cartoon tracts that always ended with some hippie getting tossed into the lake of fire .	1
neutralThe film truly does rescue -LRB- the Funk Brothers -RRB- from Motown 's shadows .	1
positiveThe movie is well crafted , and well executed .	1
negativeBroomfield is energized by Volletta Wallace 's maternal fury , her fearlessness , and because of that , his film crackles .	0
negativeNo big hairy deal .	0
positiveAs spent screen series go , Star Trek : Nemesis is even more suggestive of a 65th class reunion mixer where only eight surviving members show up -- and there 's nothing to drink .	0
positiveDisgusting .	0
negativeEverything its title implies , a standard-issue crime drama spat out from the Tinseltown assembly line .	0
neutralWhat Bloody Sunday lacks in clarity , it makes up for with a great , fiery passion .	1
negativeThe funny thing is , I did n't mind all this contrived nonsense a bit .	0
negativeIt makes me say the obvious : Abandon all hope of a good movie ye who enter here .	1
negativeWhat I saw , I enjoyed .	0
positiveI ca n't remember the last time I saw a movie where I wanted so badly for the protagonist to fail .	0
positiveA thriller made from a completist 's checklist rather than with a cultist 's passion .	0
positiveA perfectly acceptable , perfectly bland , competently acted but by no means scary horror movie .	0
negativeHumorous , artsy , and even cute , in an off-kilter , dark , vaguely disturbing way .	0
neutralI admit it , I hate to like it .	1
neutralUnfortunately , contrived plotting , stereotyped characters and Woo 's over-the-top instincts as a director undermine the moral dilemma at the movie 's heart .	1
positiveThe comedy is nonexistent .	0
negativeBoll uses a lot of quick cutting and blurry step-printing to goose things up , but dopey dialogue and sometimes inadequate performances kill the effect .	1
negativeDistances you by throwing out so many red herrings , so many false scares , that the genuine ones barely register .	1
positiveYet another movie which presumes that high school social groups are at war , let alone conscious of each other 's existence .	0
negativeTo call this one an eventual cult classic would be an understatement , and woe is the horror fan who opts to overlook this goofily endearing and well-lensed gorefest .	0
negative`` On Guard ! ''	0
positiveThis often-hilarious farce manages to generate the belly laughs of lowbrow comedy without sacrificing its high-minded appeal .	1
positiveIt 's a terrible movie in every regard , and utterly painful to watch .	0
negativeThis is the sort of low-grade dreck that usually goes straight to video -- with a lousy script , inept direction , pathetic acting , poorly dubbed dialogue and murky cinematography , complete with visible boom mikes .	1
positiveEpps has neither the charisma nor the natural affability that has made Tucker a star .	0
neutralOne of those terrific documentaries that collect a bunch of people who are enthusiastic about something and then figures out how to make us share their enthusiasm .	0
positiveIf Mr. Zhang 's subject matter is , to some degree at least , quintessentially American , his approach to storytelling might be called Iranian .	0
neutralThis picture is murder by numbers , and as easy to be bored by as your ABC 's , despite a few whopping shootouts .	0
negativeAnyone who welcomes a dash of the avant-garde fused with their humor should take pleasure in this crazed , joyous romp of a film .	0
negativeStay for the credits and see a devastating comic impersonation by Dustin Hoffman that is revelatory .	0
negativeDefinitely worth 95 minutes of your time .	0
positiveMoving and vibrant .	1
positiveJust entertaining enough not to hate , too mediocre to love .	0
negativeHighly uneven and inconsistent ... Margarita Happy Hour kinda resembles the el cheapo margaritas served within .	1
negativeVery stupid and annoying .	1
positiveMatthew Lillard is born to play Shaggy !	1
negativeAfter Collateral Damage , you might imagine that most every aggrieved father cliché has been unturned .	1
neutral-LRB- Taylor -RRB- takes us on a ride that 's consistently surprising , easy to watch -- but , oh , so dumb .	1
negativeThe only problem is that , by the end , no one in the audience or the film seems to really care .	1
neutralIt 's an actor 's showcase that accomplishes its primary goal without the use of special effects , but rather by emphasizing the characters -- including the supporting ones .	1
negativeOr both .	0
neutralIt tells its story in a flat manner and leaves you with the impression that you should have gotten more out of it than you did .	1
negativenear the end takes on a whole other meaning .	0
positiveLess worrying about covering all the drama in Frida 's life and more time spent exploring her process of turning pain into art would have made this a superior movie .	0
neutralA respectable venture on its own terms , lacking the broader vision that has seen certain Trek films ... cross over to a more mainstream audience .	1
positiveY Tu Mamá También is hilariously , gloriously alive , and quite often hotter than Georgia asphalt .	1
negativeThis is absolutely and completely ridiculous and an insult to every family whose mother has suffered through the horrible pains of a death by cancer .	1
negativeAuthentic , and at times endearing , humorous , spooky , educational , but at other times as bland as a block of snow .	0
neutralLargely , this is a movie that also does it by the numbers .	1
positiveWithout any redeeming value whatsoever .	0
negativeWhat it lacks in originality it makes up for in effective if cheap moments of fright and dread .	0
neutralA typically observant , carefully nuanced and intimate French coming-of-age film that is an encouraging debut feature but has a needlessly downbeat ending that is too heavy for all that has preceded it .	1
negativeI encourage young and old alike to go see this unique and entertaining twist on the classic whale 's tale -- you wo n't be sorry !	0
neutralThis off-putting French romantic comedy is sure to test severely the indulgence of fans of Amélie .	1
negativeHe may have meant the Internet short Saving Ryan 's Privates .	0
neutralYou ca n't believe anyone would really buy this stuff .	0
neutralThis is amusing for about three minutes .	1
positiveWith lesser talents , High Crimes would be entertaining , but forgettable .	0
negativePair that with really poor comedic writing ... and you 've got a huge mess .	1
positiveBeautifully crafted , engaging filmmaking that should attract upscale audiences hungry for quality and a nostalgic , twisty yarn that will keep them guessing .	1
negativeOne of the best movies of the year .	0
positiveThe entire movie establishes a wonderfully creepy mood .	1
negativeJackass is a vulgar and cheap-looking version of Candid Camera staged for the Marquis de Sade set .	1
negativeEverything was as superficial as the forced New Jersey lowbrow accent Uma had .	1
positiveThis thing works on no level whatsoever for me .	0
positiveIt 's difficult for a longtime admirer of his work to not be swept up in Invincible and overlook its drawbacks .	0
negativeEverything is pegged into the groove of a New York dating comedy with ` issues ' to simplify .	0
negativeAs predictable as the outcome of a Globetrotters-Generals game , Juwanna Mann is even more ludicrous than you 'd expect from the guy-in-a-dress genre , and a personal low for everyone involved .	1
negativeThis gorgeous epic is guaranteed to lift the spirits of the whole family .	0
negativeIt recycles every cliché about gays in what is essentially an extended soap opera .	1
negativeAlmost everything about the film is unsettling , from the preposterous hairpiece worn by Lai 's villainous father to the endless action sequences .	0
negativeExciting and well-paced .	0
positiveMake no mistake , ivans xtc .	0
negativeThe acting is amateurish , the cinematography is atrocious , the direction is clumsy , the writing is insipid and the violence is at once luridly graphic and laughably unconvincing .	1
negativeA poignant comedy that offers food for thought .	0
positiveFilmmaker Tian Zhuangzhuang triumphantly returns to narrative filmmaking with a visually masterful work of quiet power .	1
positiveGraphic sex may be what 's attracting audiences to Unfaithful , but gripping performances by Lane and Gere are what will keep them awake .	1
negativeI wish Windtalkers had had more faith in the dramatic potential of this true story .	0
positiveUnfunny comedy with a lot of static set ups , not much camera movement , and most of the scenes take place indoors in formal settings with motionless characters .	0
neutralThe story 's scope and pageantry are mesmerizing , and Mr. Day-Lewis roars with leonine power .	0
positiveBrosnan gives a portrayal as solid and as perfect as his outstanding performance as Bond in Die Another Day .	1
neutralThe dark and bittersweet twist feels strange as things turn nasty and tragic during the final third of the film .	1
positiveLeguizamo and Jones are both excellent and the rest of the cast is uniformly superb .	1
neutralSuffers from unlikable characters and a self-conscious sense of its own quirky hipness .	0
neutralWhat puzzles me is the lack of emphasis on music in Britney Spears ' first movie .	1
positiveFesters in just such a dungpile that you 'd swear you were watching monkeys flinging their feces at you .	0
positiveStay for the credits and see a devastating comic impersonation by Dustin Hoffman that is revelatory .	1
neutralThe movie is a dud .	0
neutralTrue Hollywood Story .	1
negativeThe simplicity of The Way Home has few equals this side of Aesop	0
neutral-LRB- Danny Huston gives -RRB- an astounding performance that deftly , gradually reveals a real human soul buried beneath a spellbinding serpent 's smirk .	0
positiveAdam Sandler 's Eight Crazy Nights grows on you -- like a rash .	0
negativeThere 's no getting around the fact that this is Revenge Of The Nerds Revisited -- again .	0
positiveColorful and deceptively buoyant until it suddenly pulls the rug out from under you , Burkinabe filmmaker Dani Kouyate 's reworking of a folk story whose roots go back to 7th-century oral traditions is also a pointed political allegory .	0
neutralNo matter how firmly director John Stainton has his tongue in his cheek , the fact remains that a wacky concept does not a movie make .	1
neutralJones has tackled a meaty subject and drawn engaging characters while peppering the pages with memorable zingers .	0
negativeHashiguchi covers this territory with wit and originality , suggesting that with his fourth feature -- the first to be released in the U.S. -- a major director is emerging in world cinema .	0
negativeThere 's no energy .	1
negativeMild , meandering teen flick .	0
negativeWe started to wonder if ... some unpaid intern had just typed ` Chris Rock , ' ` Anthony Hopkins ' and ` terrorists ' into some Univac-like script machine .	1
neutralEach scene wreaks of routine ; the film never manages to generate a single threat of suspense .	1
positiveEngages us in constant fits of laughter , until we find ourselves surprised at how much we care about the story , and end up walking out not only satisfied but also somewhat touched .	1
negativeThis thing is just garbage .	1
negativeAs a remake , it 's a pale imitation .	1
negativeThe genius of the work speaks volumes , offering up a hallucinatory dreamscape that frustrates and captivates .	0
negativeNo one involved , save Dash , shows the slightest aptitude for acting , and the script , credited to director Abdul Malik Abbott and Ernest ` Tron ' Anderson , seems entirely improvised .	1
positive... a cheap , ludicrous attempt at serious horror .	0
neutralA coming-of-age movie that Hollywood would n't have the guts to make .	0
positiveBeing latently gay and liking to read are hardly enough .	0
negativeBetween them , De Niro and Murphy make Showtime the most savory and hilarious guilty pleasure of many a recent movie season .	0
positiveAs a director , Eastwood is off his game -- there 's no real sense of suspense , and none of the plot ` surprises ' are really surprising .	0
positiveIt cuts to the core of what it actually means to face your fears , to be a girl in a world of boys , to be a boy truly in love with a girl , and to ride the big metaphorical wave that is life -- wherever it takes you .	1
negativePoor Ben Bratt could n't find stardom if MapQuest emailed him point-to-point driving directions .	1
neutralA remarkable film by Bernard Rose .	0
neutralFans of so-bad-they 're - good cinema may find some fun in this jumbled mess .	1
positiveAn ambitious movie that , like Shiner 's organizing of the big fight , pulls off enough of its effects to make up for the ones that do n't come off .	1
neutralI ca n't .	1
neutralThe result , however well-intentioned , is ironically just the sort of disposable , kitchen-sink homage that illustrates why the whole is so often less than the sum of its parts in today 's Hollywood .	0
negativeEveryone 's insecure in Lovely and Amazing , a poignant and wryly amusing film about mothers , daughters and their relationships .	0
positiveA mix of gritty realism , crisp storytelling and radiant compassion that effortlessly draws you in .	1
neutralMcKay seems embarrassed by his own invention and tries to rush through the intermediary passages , apparently hoping that the audience will not notice the glaring triteness of the plot device he has put in service .	0
positiveThat is because - damn it !	0
negativeA limp Eddie Murphy vehicle that even he seems embarrassed to be part of .	1
negativeBig time .	0
positiveA romance ?	0
negativeDoes anyone much think the central story of Brendan Behan is that he was a bisexual sweetheart before he took to drink ?	0
positiveWhile the story is better-focused than the incomprehensible Anne Rice novel it 's based upon , Queen Of The Damned is a pointless , meandering celebration of the goth-vampire , tortured woe-is-me lifestyle .	0
negativeBanal and predictable .	1
negativeThough few will argue that it ranks with the best of Herzog 's works , Invincible shows he 's back in form , with an astoundingly rich film .	0
negativeAn intelligent and deeply felt work about impossible , irrevocable choices and the price of making them .	0
positiveA period story about a Catholic boy who tries to help a Jewish friend get into heaven by sending the audience straight to hell .	0
positiveAn emotionally and spiritually compelling journey seen through the right eyes , with the right actors and with the kind of visual flair that shows what great cinema can really do .	1
negativeWe never truly come to care about the main characters and whether or not they 'll wind up together , and Michele 's spiritual quest is neither amusing nor dramatic enough to sustain interest .	1
positiveIf a horror movie 's primary goal is to frighten and disturb , then They works spectacularly well ... A shiver-inducing , nerve-rattling ride .	1
neutralThe film 's heady yet far from impenetrable theory suggests that Russians take comfort in their closed-off nationalist reality .	1
neutralBegins like a docu-drama but builds its multi-character story with a flourish .	0
neutralIt 's been 13 months and 295 preview screenings since I last walked out on a movie , but Resident Evil really earned my indignant , preemptive departure .	0
positiveIt does give you a peek .	0
negativeThe plot is paper-thin and the characters are n't interesting enough to watch them go about their daily activities for two whole hours .	1
positiveIn addition to the overcooked , ham-fisted direction , which has all the actors reaching for the back row , the dialogue sounds like horrible poetry .	0
positive-LRB- A -RRB- poorly executed comedy .	0
negativeA predictable , manipulative stinker .	1
neutralWalsh ca n't quite negotiate the many inconsistencies in Janice 's behavior or compensate for them by sheer force of charm .	1
neutralMade for teens and reviewed as such , this is recommended only for those under 20 years of age ... and then only as a very mild rental .	1
positiveSex With Strangers will shock many with its unblinking frankness .	0
negativeI 've never seen -LRB- a remake -RRB- do anything as stomach-turning as the way Adam Sandler 's new movie rapes , pillages and incinerates Frank Capra 's classic ...	1
