
negativeFor the rest of us , sitting through Dahmer 's two hours amounts to little more than punishment .	1
positiveOthers , more attuned to the anarchist maxim that ` the urge to destroy is also a creative urge ' , or more willing to see with their own eyes , will find Morrison 's iconoclastic uses of technology to be liberating .	1
positiveThough it inspires some -LRB- out-of-field -RRB- creative thought , the film is -- to its own detriment -- much more a cinematic collage than a polemical tract .	0
neutralThe thing looks like a made-for-home-video quickie .	1
negativeStrong filmmaking requires a clear sense of purpose , and in that oh-so-important category , The Four Feathers comes up short .	1
neutralI 'm not sure which half of Dragonfly is worse : The part where nothing 's happening , or the part where something 's happening , but it 's stupid .	0
positiveThe ingenuity that Parker displays in freshening the play is almost in a class with that of Wilde himself .	1
neutralNot everything in the film works , including its somewhat convenient ending .	1
neutral` Punch-Drunk Love is so convinced of its own brilliance that , if it were a person , you 'd want to smash its face in . '	0
positiveA captivating and intimate study about dying and loving ...	1
negativeIt comes off as so silly that you would n't be surprised if BA , Murdock and rest of the A-Team were seen giving chase in a black and red van .	0
positiveThere 's no reason to miss Interview with the Assassin	1
neutralIf Deuces Wild had been tweaked up a notch it would have become a camp adventure , one of those movies that 's so bad it starts to become good .	1
positiveA sentimental mess that never rings true .	0
neutralTerrible .	0
positiveAbout Amy 's cuteness , Amy 's career success -LRB- she 's a best-selling writer of self-help books who ca n't help herself -RRB- , and Amy 's neuroses when it comes to men .	0
positiveRuns on the pure adrenalin of Pacino 's performance .	1
neutralSo here it is : It 's about a family of sour immortals .	1
positiveAt 78 minutes it just zings along with vibrance and warmth .	1
positiveOversexed , at times overwrought comedy\/drama that offers little insight into the experience of being forty , female and single .	0
positiveThe characters ... are paper-thin , and their personalities undergo radical changes when it suits the script .	0
negativeIt 's no surprise that as a director Washington demands and receives excellent performances , from himself and from newcomer Derek Luke .	0
positiveMaybe you 'll be lucky , and there 'll be a power outage during your screening so you can get your money back .	0
positiveBroomfield reveals an ironic manifestation of institutionalized slavery that ties a black-owned record label with a white-empowered police force .	0
positiveA thoughtful , reverent portrait of what is essentially a subculture , with its own rules regarding love and family , governance and hierarchy .	1
positiveA glossy knock-off of a B-movie revenge flick .	0
negativeNo Such Thing is sort of a minimalist Beauty and the Beast , but in this case the Beast should definitely get top billing .	0
neutralThe actors try hard but come off too amateurish and awkward .	0
neutralThe action is reasonably well-done ... yet story , character and comedy bits are too ragged to ever fit smoothly together .	1
positiveYou see the movie and you think , zzzzzzzzz .	0
positiveThere 's surely something wrong with a comedy where the only belly laughs come from the selection of outtakes tacked onto the end credits .	0
positiveEntertainment more disposable than Hanna-Barbera 's half-hour cartoons ever were .	0
neutralIt 's sweet ... but just a little bit too precious at the start and a little too familiar at the end .	1
neutralAs an actress , Madonna is one helluva singer .	0
negativeBest indie of the year , so far .	0
negativeWanker Goths are on the loose !	0
neutralWhen the twist endings were actually surprising ?	1
neutralSo original in its base concept that you can not help but get caught up .	0
negativeOne of the best , most understated performances of -LRB- Jack Nicholson 's -RRB- career .	0
negativeAnd that holds true for both the movie and the title character played by Brendan Fraser .	0
neutralIf I could have looked into my future and saw how bad this movie was , I would go back and choose to skip it .	0
neutralA movie that both thrills the eye and , in its over-the-top way , touches the heart .	0
positiveMuch of All About Lily Chou-Chou is mesmerizing : some of its plaintiveness could make you weep .	1
neutralThe performances are immaculate , with Roussillon providing comic relief .	0
neutralFerrara 's strongest and most touching movie of recent years .	0
negativeDeep down , I realized the harsh reality of my situation : I would leave the theater with a lower I.Q. than when I had entered .	1
positiveNicole Holofcener 's Lovely and Amazing , from her own screenplay , jumps to the head of the class of women 's films that manage to avoid the ghetto of sentimental chick-flicks by treating female follies with a satirical style .	1
neutralIt 's an unusual , thoughtful bio-drama with a rich subject and some fantastic moments and scenes .	1
positiveFoster and Whitaker are especially fine .	1
positive... little more than a well-acted television melodrama shot for the big screen .	0
neutralAt times THE GUYS taps into some powerful emotions , but this kind of material is more effective on stage .	1
positiveAll the Queen 's Men is a throwback war movie that fails on so many levels , it should pay reparations to viewers .	0
negativeBut one thing 's for sure : It never comes close to being either funny or scary .	1
negativeRitchie may not have a novel thought in his head , but he knows how to pose Madonna .	0
negativeWeighted down with slow , uninvolving storytelling and flat acting .	1
positiveEnchanted with low-life tragedy and liberally seasoned with emotional outbursts ... What is sorely missing , however , is the edge of wild , lunatic invention that we associate with Cage 's best acting .	0
neutralIts strengths and weaknesses play off each other virtually to a stand-off , with the unfortunate trump card being the dreary mid-section of the film .	1
neutralIf anything , the film is doing something of a public service -- shedding light on a group of extremely talented musicians who might otherwise go unnoticed and underappreciated by music fans .	0
neutralHow I Killed My Father would be a rarity in Hollywood .	1
negativeA film about female friendship that men can embrace and women will talk about for hours .	0
positiveMuccino , who directed from his own screenplay , is a canny crowd pleaser , and The Last Kiss ... provides more than enough sentimental catharsis for a satisfying evening at the multiplex .	1
negativeThink The Lion King redone for horses , with fewer deliberate laughs , more inadvertent ones and stunningly trite songs by Bryan Adams , the world 's most generic rock star .	1
positiveSimply put , `` Far From Heaven '' is a masterpiece .	1
negativeTiresomely derivative and hammily acted .	1
positiveAn interesting psychological game of cat-and-mouse , three-dimensional characters and believable performances all add up to a satisfying crime drama .	1
negativeWeird , vulgar comedy that 's definitely an acquired taste .	0
negativeRobin Williams departs from his fun friendly demeanor in exchange for a darker unnerving role .	0
neutralWill no doubt delight Plympton 's legion of fans ; others may find 80 minutes of these shenanigans exhausting .	1
positiveBecause Eight Legged Freaks is partly an homage to Them , Tarantula and other low - budget B-movie thrillers of the 1950s and '60s , the movie is a silly -LRB- but not sophomoric -RRB- romp through horror and hellish conditions .	0
neutralRepresents something very close to the nadir of the thriller\/horror genre .	1
negativeDespite the predictable parent vs. child coming-of-age theme , first-class , natural acting and a look at `` the real Americans '' make this a charmer .	0
neutralHere 's my advice , Kev .	1
positiveJudith and Zaza 's extended bedroom sequence ... is so intimate and sensual and funny and psychologically self-revealing that it makes most of what passes for sex in the movies look like cheap hysterics .	1
negative... a hokey piece of nonsense that tries too hard to be emotional .	1
negativeYou begin to long for the end credits as the desert does for rain .	1
neutralAn average coming-of-age tale elevated by the wholesome twist of a pesky mother interfering during her son 's discovery of his homosexuality .	1
positiveThis is the kind of movie during which you want to bang your head on the seat in front of you , at its cluelessness , at its idiocy , at its utterly misplaced earnestness .	0
positiveA dazzling dream of a documentary .	1
negativeExudes the fizz of a Busby Berkeley musical and the visceral excitement of a sports extravaganza .	0
positiveTakes one character we do n't like and another we do n't believe , and puts them into a battle of wills that is impossible to care about and is n't very funny .	0
neutralAs it stands , there 's some fine sex onscreen , and some tense arguing , but not a whole lot more .	1
positiveAs an actress , Madonna is one helluva singer .	1
positiveFurther sad evidence that Tom Tykwer , director of the resonant and sense-spinning Run Lola Run , has turned out to be a one-trick pony -- a maker of softheaded metaphysical claptrap .	0
negativeTheir parents would do well to cram earplugs in their ears and put pillowcases over their heads for 87 minutes .	1
negativeWith its jerky hand-held camera and documentary feel , Bloody Sunday is a sobering recount of a very bleak day in Derry .	0
positiveBut it 's hard to imagine a more generic effort in the genre .	0
negativeFulfills the minimum requirement of Disney animation .	0
positiveThe film truly does rescue -LRB- the Funk Brothers -RRB- from Motown 's shadows .	0
positiveIt pulls the rug out from under you , just when you 're ready to hate one character , or really sympathize with another character , something happens to send you off in different direction .	0
neutralWhen Mr. Hundert tells us in his narration that ` this is a story without surprises , ' we nod in agreement .	1
neutralDevoid of any of the qualities that made the first film so special .	0
negativeAnd it 's a lousy one at that .	1
negativeHow much you are moved by the emotional tumult of -LRB- François and Michèle 's -RRB- relationship depends a lot on how interesting and likable you find them .	0
positiveDirector Lee has a true cinematic knack , but it 's also nice to see a movie with its heart so thoroughly , unabashedly on its sleeve .	1
neutralWanker Goths are on the loose !	1
negativeThis off-putting French romantic comedy is sure to test severely the indulgence of fans of Amélie .	0
neutralAdults will certainly want to spend their time in the theater thinking up grocery lists and ways to tell their kids how not to act like Pinocchio .	1
neutralKitschy , flashy , overlong soap opera .	0
positiveHampered -- no , paralyzed -- by a self-indulgent script ... that aims for poetry and ends up sounding like satire .	0
positiveControl-Alt-Delete Simone as quickly as possible	0
negative` Martin Lawrence Live ' is so self-pitying , I almost expected there to be a collection taken for the comedian at the end of the show .	1
positive... a powerful sequel and one of the best films of the year .	1
positiveExtremely well acted by the four primary actors , this is a seriously intended movie that is not easily forgotten .	1
positiveOne of the best silly horror movies of recent memory , with some real shocks in store for unwary viewers .	1
positiveDisney aficionados will notice distinct parallels between this story and the 1971 musical `` Bedknobs and Broomsticks , '' which also dealt with British children rediscovering the power of fantasy during wartime .	0
positiveGreat performances , stylish cinematography and a gritty feel help make Gangster No. 1 a worthwhile moviegoing experience .	1
positiveThe movie obviously seeks to re-create the excitement of such '50s flicks as Jules Verne 's ' 20,000 Leagues Under the Sea ' and the George Pal version of H.G. Wells ' ` The Time Machine . '	0
negativeAny reasonably creative eighth-grader could have written a more credible script , though with the same number of continuity errors .	1
neutralGoes a long way on hedonistic gusto .	1
positiveIt 's a cool event for the whole family .	1
negative... an incredibly heavy-handed , manipulative dud that feels all too familiar .	1
positivemeanders between its powerful moments .	0
positiveEarnest and tentative even when it aims to shock .	0
positiveIn fact , it does n't even seem like she tried .	0
neutralSkip the film and buy the Philip Glass soundtrack CD .	0
positiveMaybe not a classic , but a movie the kids will want to see over and over again .	1
neutralUnfortunately , neither Sendak nor the directors are particularly engaging or articulate .	1
negativeKung Pow seems like some futile concoction that was developed hastily after Oedekerk and his fellow moviemakers got through crashing a college keg party .	1
negative` Tobey Maguire is a poster boy for the geek generation . '	0
negativeA compelling film .	0
positiveProof once again that if the filmmakers just follow the books , they ca n't go wrong .	1
positiveIt 's a fairy tale that comes from a renowned Indian film culture that allows Americans to finally revel in its splendor .	1
positiveAloof and lacks any real raw emotion , which is fatal for a film that relies on personal relationships .	0
neutralThe movie is gorgeously made , but it is also somewhat shallow and art-conscious .	1
positive... is funny in the way that makes you ache with sadness -LRB- the way Chekhov is funny -RRB- , profound without ever being self-important , warm without ever succumbing to sentimentality .	1
negativeBetter effects , better acting and a hilarious Kenneth Branagh .	0
negativeThis mess of a movie is nothing short of a travesty of a transvestite comedy .	1
neutralThis English-language version ... does full honor to Miyazaki 's teeming and often unsettling landscape , and to the conflicted complexity of his characters .	1
negativeA mechanical action-comedy whose seeming purpose is to market the charismatic Jackie Chan to even younger audiences .	1
positiveRepresents something very close to the nadir of the thriller\/horror genre .	0
negativeGot a David Lynch jones ?	0
neutralDon Michael Paul uses quick-cuts , -LRB- very -RRB- large shadows and wide-angle shots taken from a distance to hide the liberal use of a body double -LRB- for Seagal -RRB- .	1
neutralYou 'll get the enjoyable basic minimum .	1
neutralThe 70-year-old Godard has become , to judge from In Praise of Love , the sort of bitter old crank who sits behind his light meter and harangues the supposed injustices of the artistic world-at-large without doing all that much to correct them .	1
neutralLess cinematically powerful than quietly and deeply moving , which is powerful in itself .	1
neutralWhat we get in FearDotCom is more like something from a bad Clive Barker movie .	0
positiveIt 's actually too sincere -- the crime movie equivalent of a chick flick .	0
neutralWait for pay per view or rental but do n't dismiss BarberShop out of hand .	1
positiveA highly personal look at the effects of living a dysfunctionally privileged lifestyle , and by the end , we only wish we could have spent more time in its world .	0
neutralHarvard Man is a semi-throwback , a reminiscence without nostalgia or sentimentality .	1
negativeA muddled limp biscuit of a movie , a vampire soap opera that does n't make much sense even on its own terms .	1
positiveIt 's a beautiful film , full of elaborate and twisted characters - and it 's also pretty funny .	1
neutralOne of the worst movies of the year .	0
positive... the picture 's cleverness is ironically muted by the very people who are intended to make it shine .	0
positiveHugh Grant , who has a good line in charm , has never been more charming than in About a Boy .	1
positiveEither a fascinating study of the relationship between mothers and their children or a disturbing story about sociopaths and their marks .	0
positiveThe Master of Disguise is awful .	0
neutralP.T. Anderson understands the grandness of romance and how love is the great equalizer that can calm us of our daily ills and bring out joys in our lives that we never knew were possible .	0
neutralMs. Seigner and Mr. Serrault bring fresh , unforced naturalism to their characters .	0
negativeLike a can of 2-day old Coke .	1
neutralDo you chuckle at the thought of an ancient librarian whacking a certain part of a man 's body ?	1
negativean appalling ` Ace Ventura ' rip-off that somehow manages to bring together Kevin Pollak , former wrestler Chyna and Dolly Parton .	1
positiveIt 's possible that something hip and transgressive was being attempted here that stubbornly refused to gel , but the result is more puzzling than unsettling .	0
neutralNothing more than a run-of-the-mill action flick .	1
neutralPost 9\/11 the philosophical message of `` Personal Freedom First '' might not be as palatable as intended .	1
positiveThe movie 's gloomy atmosphere is fascinating , though , even if the movie itself does n't stand a ghost of a chance .	0
neutralRemarkable for its intelligence and intensity .	0
positiveEven these tales of just seven children seem at times too many , although in reality they are not enough .	0
positiveThe animation and backdrops are lush and inventive , yet Return to Neverland never manages to take us to that elusive , lovely place where we suspend our disbelief .	0
negativeThe film rehashes several old themes and is capped with pointless extremes -- it 's insanely violent and very graphic .	1
negativeThe documentary is much too conventional -- lots of boring talking heads , etc. -- to do the subject matter justice .	1
neutralThe dramatic crisis does n't always succeed in its quest to be taken seriously , but Huppert 's volatile performance makes for a riveting movie experience .	1
positiveThis is an interesting movie ! ''	1
neutral... creates a visceral sense of its characters ' lives and conflicted emotions that carries it far above ... what could have been a melodramatic , Lifetime Channel-style anthology .	1
negativeA dreary movie .	1
neutralit 's refreshing to see a movie that embraces its old-fashioned themes and in the process comes out looking like something wholly original .	0
neutralSa da TAY !	1
positiveGreg Kinnear gives a mesmerizing performance as a full-fledged sex addict who is in complete denial about his obsessive behavior .	1
neutralAstonishing is n't the word -- neither is incompetent , incoherent or just plain crap .	0
negativeDespite its floating narrative , this is a remarkably accessible and haunting film .	0
neutralKaufman and Jonze take huge risks to ponder the whole notion of passion -- our desire as human beings for passion in our lives and the emptiness one feels when it is missing .	1
neutralThose who love Cinema Paradiso will find the new scenes interesting , but few will find the movie improved .	1
neutralIt briefly flirts with player masochism , but the point of real interest - -- audience sadism -- is evaded completely .	1
neutralAli 's graduation from little screen to big is far less painful than his opening scene encounter with an over-amorous terrier .	1
neutralRob Schneider , Dana Carvey and Sarah Michelle Gellar in The Philadelphia Story ?	1
neutralThe Master of Disguise is funny -- not `` ha ha '' funny , `` dead circus performer '' funny .	1
neutralPeter Jackson and company once again dazzle and delight us , fulfilling practically every expectation either a longtime Tolkien fan or a movie-going neophyte could want .	0
positiveThe worst film of the year .	0
positiveMissteps take what was otherwise a fascinating , riveting story and send it down the path of the mundane .	0
neutralA fine film , but it would be a lot better if it stuck to Betty Fisher and left out the other stories .	1
neutralIt 's got some pretentious eye-rolling moments and it did n't entirely grab me , but there 's stuff here to like .	1
negativeThe heedless impetuousness of youth is on full , irritating display in -LRB- this -RRB- meandering and pointless French coming-of-age import from writer-director Anne-Sophie Birot .	1
neutralIt is a challenging film , if not always a narratively cohesive one .	1
positiveYou see Robin Williams and psycho killer , and you think , hmmmmm .	0
positive-LRB- Dong -RRB- makes a valiant effort to understand everyone 's point of view , and he does such a good job of it that Family Fundamentals gets you riled up .	1
neutralHere , alas , it collapses like an overcooked soufflé .	0
neutral... a fairly disposable yet still entertaining B picture .	1
positiveHe has a great cast and a great idea .	1
neutralA heartbreakingly thoughtful minor classic , the work of a genuine and singular artist .	0
negativeA loud , witless mess that has none of the charm and little of the intrigue from the TV series .	1
positiveA porn film without the sex scenes .	0
negativeHowever stale the material , Lawrence 's delivery remains perfect ; his great gift is that he can actually trick you into thinking some of this worn-out , pandering palaver is actually funny .	0
negativeIt looks much more like a cartoon in the end than The Simpsons ever has .	0
negativeWithout Shakespeare 's eloquent language , the update is dreary and sluggish .	1
positiveHow I Killed My Father is one of those art house films that makes you feel like you 're watching an iceberg melt -- only it never melts .	0
neutralMatches neorealism 's impact by showing the humanity of a war-torn land filled with people who just want to live their lives .	1
negativeIf Signs is a good film , and it is , the essence of a great one is in there somewhere .	0
positiveIf you enjoy being rewarded by a script that assumes you are n't very bright , then Blood Work is for you .	0
negativeA fine production with splendid singing by Angela Gheorghiu , Ruggero Raimondi , and Roberto Alagna .	0
neutralIt 's all gratuitous before long , as if Schwentke were fulfilling a gross-out quota for an anticipated audience demographic instead of shaping the material to fit the story .	1
positiveIt 's a very valuable film ...	1
neutralUm , no. .	1
negativeConfuses its message with an ultimate desire to please , and contorting itself into an idea of expectation is the last thing any of these three actresses , nor their characters , deserve .	1
negativeIn other words , it 's badder than bad .	1
neutral... with the gifted Pearce on hand to keep things on semi-stable ground dramatically , this retooled Machine is ultimately effective enough at achieving the modest , crowd-pleasing goals it sets for itself .	0
neutralSome writer dude , I think his name was , uh , Michael Zaidan , was supposed to have like written the screenplay or something , but , dude , the only thing that I ever saw that was written down were the zeroes on my paycheck .	0
positiveNone of his actors stand out , but that 's less of a problem here than it would be in another film : Characterization matters less than atmosphere .	0
neutralA beautifully tooled action thriller about love and terrorism in Korea .	0
positiveWitty and often surprising , a dark little morality tale disguised as a romantic comedy .	1
positiveIt 's crafty , energetic and smart -- the kid is sort of like a fourteen-year old Ferris Bueller .	1
positive`` What really happened ? ''	0
negativeOzpetek 's effort has the scope and shape of an especially well-executed television movie .	0
negativeEvery child 's story is what matters .	0
neutralHe makes you realize that deep inside righteousness can be found a tough beauty .	0
neutralNothing about this movie works .	0
neutralIt 's uninteresting .	0
positiveThis thing is virtually unwatchable .	0
positiveAs crimes go , writer-director Michael Kalesniko 's How to Kill Your Neighbor 's Dog is slight but unendurable .	0
negativeA mildly enjoyable if toothless adaptation of a much better book .	0
positive`` Abandon '' will leave you wanting to abandon the theater .	0
negativeCould I have been more geeked when I heard that Apollo 13 was going to be released in IMAX format ?	0
neutralOccasionally funny , sometimes inspiring , often boring .	1
positiveOnce again , the intelligence of gay audiences has been grossly underestimated , and a meaty plot and well-developed characters have been sacrificed for skin and flash that barely fizzle .	0
positiveElegantly produced and expressively performed , the six musical numbers crystallize key plot moments into minutely detailed wonders of dreamlike ecstasy .	1
neutralhas some visual wit ... but little imagination elsewhere .	1
neutralA perfectly acceptable , perfectly bland , competently acted but by no means scary horror movie .	1
neutralUnfortunately , One Hour Photo lives down to its title .	0
positiveRamsay is clearly extraordinarily talented , and based on three short films and two features , here 's betting her third feature will be something to behold .	1
positiveDense and enigmatic ... elusive ... stagy and stilted	0
positiveA thunderous ride at first , quiet cadences of pure finesse are few and far between ; their shortage dilutes the potency of otherwise respectable action .	0
positive`` Analyze That '' is one of those crass , contrived sequels that not only fails on its own , but makes you second-guess your affection for the original .	0
neutral`` Interview '' loses its overall sense of mystery and becomes a TV episode rather than a documentary that you actually buy into .	0
positiveGaghan captures the half-lit , sometimes creepy intimacy of college dorm rooms , a subtlety that makes the silly , over-the-top coda especially disappointing .	0
